nome;vendedor;Avaliação;reviews;preco_antigo;preco_atual
Case Compatível Com Base Inferior Inferior Novo Para;;;;259.0;246.0
Capa Traseira Compatível Com Latitude 3330;;;;221.0;210.0
"Notebook Lenovo Ideapad 1 Intel Core i3 1215U 8GB RAM 256GB SSD Windows 11 Home Tela 15,6"" 82VY000SBR";Vikings;4.8;6087;3.998;2.463
Notebook Acer Nitro 51uz Ci5 13ªg 16gb Ram 512ssd Rtx4050;Acer Brasil;4.9;21;6.999;5.199
Notebook Vaio Fe15 Amd Ryzen 5 8gb Ram 256gb Windows 11 Home Cor Cinza;;4.8;91;3.563;2.999
Notebook Samsung Galaxy Book4 Intel® U300 (1.20 Ghz, até 4.4GHz, 8 MB L3 Cache), Windows 11 Home, 8GB, 256GB SSD, UHD Graphics, 15.6'' Full HD LED, 1.55kg;Vikings;4.8;9114;4.499;3.099
Notebook Lenovo Ideapad 1i Intel Core i5 - 1235U, 8GB RAM, 512GB SSD, Windows 11 Home, Tela 15,6'' HD - 82VY000QBR;Vikings;4.8;5072;4.199;2.911
Notebook Acer Gamer Nitro V15 Intel Core i7 13ª Ger. 32GB 512SSD RTX3050 com 6GB GDDR6 Nvidia GeForce Linux Gutta ANV15-51-73BP;Vikings;4.8;206;8.998;5.984
Notebook Lenovo LOQ-e 15iax9e Intel Core i5-12450hx 16gb 512gb Ssd Rtx 3050 Windows 11 15.6 - 83me0007br Luna Grey;Mobcom;4.9;627;7.0;5.099
Notebook Asus X515 Intel Celeron Dual Core N4500 4gb Ram 128gb Ssd Windows 11 Home Tela 15,6 Led Hd Slate Grey - Br309ws;;4.7;919;2.033;1.598
Notebook Gamer Predator Helios Neo / Phn16-72-74vx / Intel® Core I7-14700hx De 14ªgeração / 16gb / 512ssd / Windows 11 Home / Nvidia Geforce Rtx 4070 Gddr6 / Tela 16;Acer Brasil;4.8;145;12.999;9.999
Notebook Acer Aspire 5 A515-45-r0xr Ryzen7 8gb 256gb Ssd 15.6 Full Hd Linux Gutta;Vikings;4.8;932;4.141;2.754
"Notebook Positivo Vision Intel Core i3 8gb RAM 256gb Ssd Tela 15.6"" Full Hd Linux - Preto";123 Comprou;4.6;213;3.212;2.024
Notebook Gamer Acer Nitro V Intel Core i7 13ª Geração 16GB 512GB RTX4050 Linux Gutta 15.6' FHD ANV15-51-7037;Acer Brasil;4.8;2112;7.299;6.099
"Notebook Lenovo IdeaPad 1 15IAU7 Intel Core i7-1255U HD 15.6"" Intel Iris Xe 512GB SSD 12GB RAM Windows 11- 82VY000PBR";Carrefour;4.7;289;4.799;3.915
Notebook VAIO FE15 Intel Core i5 12th 16GB 512GB SSD Tela 15,6'' Full HD Antirreflexo Windows 11 Home Cinza Grafite B2621H;INPOWER;4.8;897;4.599;3.699
"Notebook ASUS Vivobook Go 15 E510KA Intel Celeron Dual Core N4500 4GB Ram 128GB EMMC Windows 11 Home 15,60"" HD Black - BR808WS";Asus;4.4;124;1.999;1.618
Notebook Gamer ASUS TUF Gaming A15 AMD Ryzen 7 7435HS 3,1 GHz RTX3050 16GB RAM 512GB SSD Windows 11 Home Tela 15,6 144Hz IPS FHD Graphite Black - FA506NCR-HN088W;Mercado Livre;4.9;78;6.499;5.999
Notebook ASUS Vivobook Go 15 E1504 AMD RYZEN 5 7520U 8GB Ram 256GB SSD Linux KeepOS 15,6” FHD Black E1504FA-NJ731;Mercado Livre;4.8;1056;2.729;2.593
Notebook Positivo Vision R15 Lumina Bar, AMD Ryzen 5 8GB 256GB, Tela 15 polegadas Full HD Antirreflexo, Linux - Preto;123 Comprou;4.7;79;3.284;2.299
Notebook VAIO FE16 AMD Ryzen 5-5625U Linux 8GB RAM 256GB SSD Wi-Fi 6 Tela 16'' IPS WUXGA Antirreflexo - Cinza Grafite - Vjfe69f11x-b0411h - Permite upgrade de memória RAM e SSD;123 Comprou;4.8;63;4.57;2.969
Notebook Multi Ultra Celeron N4020c 4gb 128gb W11 14'' Cinza;123 Comprou;4.5;648;2.064;1.25
Notebook Acer Vero AV15-53P-72JT Intel Core i7 – 1355U 13ªG 16GB 512GB SSD W11 15.6”;Vikings;5.0;10;6.284;3.871
Notebook Gamer Acer Nitro V ANV15-51-57WS Intel® Core™ i5-13420H 13ªGeração 512SSD 8GB Nvidia® GeForce® RTX 3050 GDDR6 Linux Gutta 15,6';Acer Brasil;4.8;3590;5.299;4.699
Notebook Acer Nitro V15 Anv15-52-96aq Intel® Core I9-13900h De 13° G 16gb 512gb Ssd Rtx4060 Windows 11 Home 15.6;Acer Brasil;4.5;11;8.999;7.799
Notebook Lenovo Ideapad Slim 3 15irh10 Intel Core i5-13420h 8gb 512gb Ssd Linux 15.3 - 83nss00000 Luna Grey;Lenovo;4.9;10;3.199;2.799
Notebook Positivo Vision C15 Lumina Bar Celeron 4gb 128gb Emmc Tela 15 Hd Antirreflexo Windows 11 Tecla Link Cinza;Positivo;4.6;3696;1.999;1.499
Notebook Asus Vivobook S14 S3407va Intel Core I7 13620h 16gb Ram 512gb Ssd Windows 11 Tela 14 Led Fhd Silver - Ly043w;Asus;5.0;4;5.999;5.045
Notebook Asus Vivobook 15 X1504va Intel Core I5 1334u 8gb Ram 512gb Ssd Intel Iris Xe Windows 11 Home Tela 15,6 Fhd Silver - Nj1740w;Asus;4.9;57;3.599;2.914
Notebook Dell Inspiron I15-i120k-a25p I5 8gb 512gb 15.6 W11;Dell;4.8;2198;3.698;3.37
Notebook Dell Inspiron I15-i3100-a15p Core 3 8gb 512gb W11 Preto;Dell;5.0;3;;2.949
Compatível Novo Para El Painel Táctil Legion 5 Pro-16ach6h,;;;;118.0;112.0
"Notebook Gamer Acer Nitro V Intel Core I5 - 13420H, 8GB Ram, 512GB SSD, NVIDIA RTX4050, Windows 11 Home, Tela 15,6"" Full HD - ANV15-51-54DL";Acer Brasil;4.8;1567;7.299;5.499
Notebook Aspire GO 15 Ag15-71p-5405 Ci5 16gb 512gb Ssd Led Linux Acer;Mercado Livre;4.9;20;4.932;2.999
"Notebook Acer TravelMate Intel® Core™ i7–1355U de 13ª Geração 16GB RAM 512SSD Windows 11 Pro 14"" WUXGA TMP214-55-70G2";Acer Brasil;4.6;16;7.999;4.499
Notebook C14 15.6 Preto 4gb De Ram - Intel Celeron;Carrefour;;;1.584;1.399
"Notebook Acer Aspire 3 Intel Core I3 - N305, 8G RAM, 256GB SSD, Windows 11 Home, Tela 15,6"" Full HD - A315-510P-34XC 110V/220V";Mercado Livre;4.8;9399;3.682;2.598
Notebook Multi Ultra Celeron N4020c 4gb 128gb W11 15,6'' Cinza - Ub261;;4.6;505;2.141;1.225
"Notebook Vaio Fe16 Amd Ryzen 5-5625u Windows 11 Home 8gb RAM 256gb Ssd Wi-Fi 6 Tela 16"" Ips Wuxga Antirreflexo - Cinza Grafite - Vjfe69f11x-b0421h - Permite upgrade de memória RAM e SSD";Loi Brasil;5.0;3;4.666;2.999
Notebook Acer Aspire 5 15.6 Fhd I5-12450h 256gb Ssd 8gb Cor Cinza;Itotal;4.6;130;3.99;2.747
"Notebook Acer Aspire 3 Intel Core i3– N305 FHD 15.6"" LED TN UHD para processadores Inte 256GB SDD 8GB RAM Debian 64 bits Prata - A315-510P-320B";Eshop;4.8;467;3.237;2.541
Notebook Lenovo Ideapad 1i Intel Core I3 - 1215U, 4GB RAM, 256GB SSD, Windows 11 Home, Tela 15.6'' - 82VY000TBR Cor cinza;TCN;4.8;1572;3.19;2.289
Notebook Asus Vivobook Go 15 E1504fa Amd Ryzen 5 7520u 16gb Ram 512gb Ssd Linux Keepos Tela 15,6 Led Fhd Black - Nj1288;Asus;4.8;437;3.299;2.695
Compatível 6 Dc 12v On/off Switch In;;;;101.0;96.0
Notebook Positivo Vision C15 Lumina Bar Celeron 8gb 128gb Emmc 15 Hd Linux - Cinza;123 Comprou;4.1;7;2.427;1.529
"Notebook ASUS Vivobook Go E1504GA Intel Core i3 N305 8GB Ram 512GB SSD Windows 11 Tela 15,6"" FHD Silver - NJ435W";Fast Shop;4.9;793;3.199;2.734
Notebook Asus Vivobook 15 X1504va Intel Core I5 1334u 4gb Ram 256gb Ssd Linux Keepos Tela 15,6 Led Fhd Silver - Nj1726;Asus;4.6;32;2.799;2.491
Notebook Inspiron I15-i1300-a80p I7 16gb 1tb W11 Preto Dell;Dell;4.0;7;5.398;4.899
Notebook Acer Vero AV15-53P-56HM Intel® Core™ i5 – 1335U 15.6” Full HD Intel® Iris® Xe 512 GB SSD 8 GB RAM Windows 11 Home;2Eletro;4.9;58;4.636;2.999
Notebook Hp 256r G9 Intel Core I3-1315u 15.6 Hd Intel Uhd Graphics 256gb Ssd 8gb Ram Windows 11 Home 64 Sl - AN1A2LA#AK4;HP;4.8;356;3.232;2.754
Notebook VAIO FE15 Intel Core i5 12th 16GB 512GB SSD Tela 15,6'' Full HD Antirreflexo Windows 11 Home Cinza Grafite B2621H;INPOWER;4.8;897;4.599;3.699
Notebook Dell 15.6  Fhd Intel I7 16gb 512gb Ssd Preto;Dell;4.8;47;4.739;4.399
Notebook Positivo Vision C14 Lumina Bar Celeron 8gb 256gb Emmc Tela 14 Polegadas Hd Antirreflexo Linux Tecla Link - Cinza;Positivo;4.5;559;2.099;1.399
Notebook Hp 256r G9 Intel Core I3-1315u 15.6 Hd Intel Uhd Graphics 256gb Ssd 8gb Ram Windows 11 Home 64 Sl - AN1A2LA#AK4;HP;4.8;356;3.232;2.754
Notebook Lenovo Ideapad Slim 3 15irh10 Intel Core i5-13420h 16gb 512gb Ssd Windows 11 15.3 - 83ns0001br Luna Grey;Lenovo;4.9;31;3.799;3.329
Compatível 6 Dc 12v On/off Switch In;;;;101.0;96.0
"Notebook Positivo Vision C15 Lumina Bar Celeron, 8GB 128GB eMMC, Tela 15.6"" HD Antirreflexo, Windows 11, Tecla Link, Cinza";Positivo;4.6;1232;2.641;1.756
Notebook Samsung Galaxy Book4 Intel® Core™ i5-1335U (1.3 Ghz, até 4.6GHz, 12 MB L3 Cache), Windows 11 Home, 8GB, 512GB SSD, Iris Xe, 15.6'' Full HD LED, 1.55kg;Samsung;4.8;2254;4.099;3.704
Ventilador De Acampamento Usb Operado Por;;;;142.0;135.0
Notebook Lenovo LOQ-e 15iax9e Intel Core i5-12450hx 16gb 512gb Ssd Rtx 3050 Windows 11 15.6 - 83me0007br Luna Grey;Mobcom;4.9;627;5.879;4.899
Notebook Positivo Vision R15 Lumina Bar, AMD Ryzen 5 8GB 256GB, Tela 15 polegadas Full HD Antirreflexo, Linux - Preto;123 Comprou;4.7;79;3.284;2.299
"Notebook Positivo Vision Intel Core i3 8gb RAM 256gb Ssd Tela 15.6"" Full Hd Linux - Preto";123 Comprou;4.6;213;3.212;2.024
Compatível Substituição Moldura Frontal Tampa Lcd Para;;;;56.0;53.0
"Notebook Positivo Duo 2 em 1 Intel Celeron C4128B-3 4GB 128GB 11,6"" IPS HD Windows 11";Positivo;4.5;5385;1.649;1.299
Notebook Gamer Lenovo Loq-e Ci5 Rtx3050 512gb 16gb W11+ubook;Mobcom;4.9;114;6.657;4.699
Compatível Novo Para Thinkpad L13 Gen 3, Maiúsculas Para;;;;211.0;200.0
Capa Para Apoio De Mãos Compatível Com Precision 3570;;;;227.0;216.0
Ventilador De Resfriamento Compatível Para Computador;;;;40.0;38.0
Notebook Positivo Vision C15 Lumina Bar Celeron, 8gb 256gb Emmc, Tela 15 Polegadas Hd Antirreflexo, Linux, Tecla Link, Cinza;Positivo;4.7;230;2.199;1.499
Notebook Hp 256r G9 Intel Core I3-1315u 15.6 Hd Intel Uhd Graphics 256gb Ssd 8gb Ram Windows 11 Home 64 Sl - AN1A2LA#AK4;HP;4.8;356;3.232;2.754
Notebook Gamer Lenovo Loq-e Ci5 Rtx3050 512gb 16gb W11+ubook;Mobcom;4.9;114;6.657;4.699
Capa Traseira Compatível Com Lcd Latitude 3440;;;;184.0;174.0
Cabo De Substituição Do Touchpad Trackpad Compatível Com;;;;129.0;122.0
Novo Alto-falante Integrado Compatível Para Ideapad Pro 5;;;;124.0;118.0
Licença De Botão Liga/desliga Para Laptop Compatível Com;;;;72.0;68.0
Compatível Novo Cabo Táctil Thinkpad X1 Carbon 7º 8º;;;;97.0;92.0
Compatível Altavoz Para Portátil Durável Reemplaza;;;;95.0;90.0
Teclado De Laptop De Substituição Compatível Com 86 Teclas;;;;42.0;40.0
= Caderno Grande De Couro Vintage A5, De Desenho, Criativo.;;;;;85.0
Compatível 5h40x89386 Para Ventiladores De Dissipador De;;;;368.0;349.0
Ventilador De Refrigeração De Substituição Compatível;;;;324.0;308.0
Compatível Tela Lcd Tampa Traseira Fhd24 Nova Para;;;;297.0;282.0
Compatível Funda Trasera Plata 5cb1b96517 Para Ideapad;;;;291.0;277.0
Capa Traseira Compatível Com Inspiron 16 5630 5635;;;;287.0;272.0
Nova Capa Traseira Compatível Para Inspiron 16plus 7630;;;;285.0;270.0
Capa Traseira Compatível 0tkxft Nova Para Latitude 7520,;;;;281.0;267.0
Ventilador De Resfriamento Compatível Para Laptop, Cpu, Gpu,;;;;;265.0
Tampa Inferior Do Alojamento Inferior Compatível;;;;276.0;262.0
Capa Traseira Compatível Para Lcd Pavilion 16-af 16-ag;;;;265.0;251.0
Nova Caixa Inferior Compatível Para Latitude 13 3330 0133ff;;;;259.0;246.0
Compatível Nueva Cubierta Inferior De La Base Inferior For;;;;249.0;236.0
Compatível Novo Para Reposamanos L13 Upper Case Kb Bezel No;;;;238.0;226.0
Abridor De Estação De Lubrificação Compatível;;;;234.0;222.0
Caixa Superior Compatível Com Apoio Para As Mãos Ideapad;;;;232.0;221.0
Capa Compatível Nova Para Thinkbook 16 G6 Irl 16 G7 Iml;;;;232.0;221.0
Novo Compatível Com Precision 7680 Com Apoio Para As Mãos E;;;;232.0;221.0
Gabinete Inferior Compatível 5cb1m48390 Para Thinkbook 16 G6;;;;227.0;216.0
Compatível Com 0jdvg5 Para Latitude 7320, Tampa Traseira De;;;;227.0;216.0
Nova Capa Traseira Lcd Compatível Para Probook 650 G9 655;;;;226.0;215.0
Compatível Com Latitude E5520 E5530 Apoio Para As Mãos;;;;221.0;210.0
Capa Traseira Lcd Compatível 08t46t Para Inspiron 14pro 5420;;;;221.0;210.0
Novo Compatível Para A Base Inferior Da Caixa Do;;;;216.0;205.0
Novo Compatível Para Latitude 7490, Caixa Inferior,;;;;211.0;200.0
Compatível 5cb1b60408 Para Ideapad 3-14itl6 3 14aba7,;;;;211.0;200.0
Gabinete Inferior Compatível M46280-001 Para Probook X360;;;;211.0;200.0
Carcaça Traseira De Lcd Prata Compatível L03439-001 Para;;;;211.0;200.0
Novo Case Compatível Com Moldura Frontal Lcd 0007x8 Para;;;;211.0;200.0
Base Inferior Compatível Para Elitebook 735 830;;;;211.0;200.0
Nova Capa Traseira Lcd Compatível Com Ideapad Gaming;;;;210.0;199.0
Capa Traseira Lcd Compatível 094d8x Para Precision 3560;;;;208.0;198.0
Compatível Nova Cubierta Trasera Para Latitude E5320 E5330;;5.0;1;205.0;195.0
Compatível Nuevo Bisel Frontal Lcd Precisão 7710 7720,;;;;205.0;195.0
Capa Traseira Lcd Compatível L53035-001 Para Pavilion X360;;;;205.0;195.0
Compatível 0638v6 Para Inspiron 14 5493, Cubierta Trasera,;;;;205.0;194.0
Caixa Traseira De Tela Lcd Compatível Com Dobradiças;;;;200.0;190.0
Carcaça Traseira De Lcd Compatível 5cb0n86313, Nova Para;;;;194.0;185.0
Nova Caixa Minúscula Compatível Para Precision 3490 0npnwd;;;;194.0;185.0
Capa Inferior Compatível Nova Para Yoga C740-14iml Yoga C740;;;;189.0;179.0
Capa De Tela Lcd Azul Compatível 5cb1b60409 Para;;;;189.0;179.0
Nova Capa Traseira De Lcd Para Thinkpad;;;;189.0;179.0
Compatível Com L44056-001, Tampa Traseira De Tela Lcd, Nova;;;;189.0;179.0
Compatível Com Latitude E5570 M3510, Caixa Inferior;;;;189.0;179.0
Ventilador De Refrigeração Compatível Para Bs5005hs U3j Cpu;;;;188.0;179.0
Substituição De Ventilador De Resfriamento Compatível;;;;186.0;177.0
Caixa Superior Compatível Com Apoio Para As Mãos Latitude;;;;183.0;174.0
Compatível Com Thinkpad T14 Gen 1, Descanso Para As Mãos,;;;;183.0;174.0
Compatível Com 5cb0z69230, Nova Capa Traseira De Plástico;;;;183.0;174.0
Capa De Tela Compatível Com Moldura Frontal Nova Para;;;;183.0;174.0
Capa Compatível Com Moldura Frontal De Tela Para;;;;182.0;173.0
Ventilador De Resfriamento Interno De Substituição;;;;181.0;172.0
Compatível Imagem De Cabo De Linha Usb Personalizado Para;;;;179.0;170.0
Compatível L47554-001 Para 240 G7 245 G7, 14 Cm, 14 Cm,;;;;178.0;169.0
Base De Gabinete Compatível Com Hp Envy M6 Series M6-1000;;;;178.0;169.0
Capa Para Caixa Inferior Compatível 03v6j8;;;;173.0;164.0
Capa Traseira De Tela Lcd Compatível 0yk5cx Nova Para;;;;173.0;164.0
Compatível 06wt7m Para Tela Precision 7550, Capa;;;;167.0;159.0
Compatível Com Latitude 3120, Novo, Apoio Para As Mãos,;;;;167.0;158.0
Capa Traseira Compatível Com 07c1dw Para Latitude 5440;;;;159.0;151.0
Compatível Nueva Cubierta Frontal Con Bisel Lcd 0d7wcv For;;;;151.0;143.0
Nova Capa Frontal Compatível Com Moldura De Tela Lcd;;;;151.0;143.0
Substituição De Ventoinha De Cpu E Gpu Compatível Para Omen;;;;146.0;139.0
Capa Compatível Com Dobradiça Para Thinkbook 13s G2 Itl 13s;;;;;138.0
Capa Nova Compatível Com Dobradiça Lcd Ideapad Yoga;;;;;133.0
Novo Painel Frontal Lcd Compatível 0xt5c5 Para Latitude 5440;;;;;133.0
Compatível Com Latitude 5430 5431 M.2 2280 Ssd, Suporte;;;;;133.0
Moldura Frontal Lcd Compatível 5b30s18891 Para Ideapad;;;;140.0;133.0
Compatível 03nvyx, Nova Capa Frontal Lcd Para;;;;135.0;128.0
Compatível Com Latitude 5440 Precision 3480 Lcd, Moldura;;;;135.0;128.0
Compatível Nuevo Marco De Bezel Front De Pantalla Para;;;;135.0;128.0
Ventilador Portátil Dc12v Compatível Com Resfriamento;;;;130.0;124.0
Compatível Com M07163-001 Para Elitebook 840 G7 840 G8 Com;;;;129.0;123.0
Novo Compatível Com Thinkpad T14 Gen 2, Painel Frontal Lcd;;;;129.0;123.0
Substituição De Ventilador De Resfriamento Compatível;;;;129.0;122.0
Ventilador De Resfriamento Compatível Para Substituição Do;;;;129.0;122.0
Teclado Compatível Com Laptop Em Inglês Dos Eua;;;;121.0;115.0
Painel De Toque Compatível Novo Para Ideapad 3-14itl6;;;;118.0;112.0
Novo Compatível Para Thinkpad L15 Gen 1 Gen 2 L+r 5h50s73137;;;;118.0;112.0
Compatível Com Placa De Botão De Energia Usb;;;;113.0;107.0
Compatível Juego De Bisagras Lcd L+r 5h50s28885 For V14-iil;;;;113.0;107.0
Capa Compatível Com Dobradiça Ideapad Flex 5-15iil05;;;;113.0;107.0
Placa De Circuito Impresso De Teclado Compatível;;;;111.0;105.0
Teclado De Madeira Compatível Com Teclado De 4 Peças;;;;110.0;104.0
Pacote Com 6 Chaves Transparentes Compatíveis;;;;107.0;101.0
Compatível 1 Cabo Macho Para 2 Fêmeas 4 Peças;;;;106.0;100.0
Novo Compatível Com Alto-falantes Precision 15 5510 Xps 9550;;;;97.0;92.0
Compatível Novo Juego De Bisagras Lcd Con Eje L+r For;;;;102.0;97.0
Cabo De Webcam Rgb Edp Compatível 5c11c12521 Para;;;;102.0;97.0
Compatível Novo Cabo De Câmera Webcam Para Câmera Lcd;;;;102.0;97.0
Novo Compatível Para Thinkpad X13 Gen 2 X13 Gen 3,;;;;102.0;97.0
Compatível Com 02hk989 Para Thinkpad T490 P14s T14 Gen 1;;;;102.0;96.0
Interruptores De Teclado Mecânico Leves Compatíveis Para;;;;99.0;94.0
Interruptor De Teclado Compatível Com 4 Exaustores,;;;;98.0;93.0
Suporte Para Copiar E Colar Teclados De 2 Teclas Para;;;;98.0;93.0
Cabo Lcd Flexível Compatível Com Realme Gt Neo5 Se;;;;98.0;93.0
Novo Painel De Toque Compatível Com Latitude 5410 E5410;;;;97.0;92.0
Cabo Rígido Flexível Compatível Com Latitude;;;;96.0;91.0
Placa De Botão De Energia Compatível Com Cabo Para;;;;94.0;89.0
Botão De Energia Compatível Para Laptop, Placa;;;;92.0;87.0
Cabo Compatível C5c10s73197 Para Painel De Toque Thinkpad;;;;91.0;87.0
Conjunto De Alto-falantes Integrados Compatíveis Com Ideapad;;;;91.0;87.0
Apoio De Mãos Compatível Com Caixa Para 840;;;;90.0;86.0
Compatível Com 3 Barras De Espaço De Cinco Lados Com Base;;;;88.0;83.0
Nova Caixa Inferior Compatível Para Latitude 5550 04mhg0;;;;210.0;199.0
Cabo Lcd Edp Compatível Com Thinkpad T590 T15 01yt323;;;;80.0;76.0
Compatível Com 0rff51 Para Ventilador De Resfriamento De Cpu;;;;80.0;76.0
Novo Teclado Compatível Com Win8 Em Espanhol Para 14-3000;;;;79.0;75.0
Conjunto De Prata Compatível Em Inglês Para Laptop;;;;77.0;73.0
Divisor Argb Compatível Com Hub Divisor De Led De Interface;;;;77.0;73.0
Compatível Cabo Conector De Disco Rígido Conector De Hdd;;;;77.0;73.0
Compatível Com 2 Botões De Teclado De Borracha Condutiva;;;;74.0;70.0
Modelo Compatível 1x Modelos De Suporte;;;;74.0;70.0
Keycaps De Pbt Compatíveis Com 71 Teclas Coral Sea Dye;;;;71.0;68.0
Ventilador De Refrigeração De Substituição Compatível;;;;71.0;67.0
Ventilador De Resfriamento Interno Compatível Para Laptop,;;;;70.0;66.0
Compatível Novo Para El Reposamanos Legion 5-15imh05h;;;;265.0;252.0
Ventilador Portátil Compatível Com Ga503rm Com 4 Pinos De;;;;66.0;62.0
Ventilador De Refrigeração De Substituição Compatível Para;;;;66.0;62.0
Cabo Compatível De Toma De Alimentación 04vp7c For;;;;64.0;61.0
Keycaps Pretos Compatíveis Com 132 Teclas, Keycaps;;;;64.0;60.0
Placa De Alimentação Compatível Danificada 450 6050a2493201;;;;63.0;60.0
Substituição De Ventilador De Resfriamento Compatível;;;;61.0;58.0
Tampas De Chave Abs Transparentes Compatíveis Com 10 Peças,;;;;58.0;55.0
Adaptador De Conector Dourado De Ângulo 5 F Compatível;;;;58.0;55.0
Notebook Dell 15.6  Fhd Intel I7 16gb 512gb Ssd Preto;Dell;4.8;47;4.739;4.399
Notebook Positivo Vision C14 Lumina Bar Celeron 8gb 256gb Emmc Tela 14 Polegadas Hd Antirreflexo Linux Tecla Link - Cinza;Positivo;4.5;559;2.099;1.399
Notebook Positivo Vision C15 Lumina Bar Celeron, 8gb 256gb Emmc, Tela 15 Polegadas Hd Antirreflexo, Linux, Tecla Link, Cinza;Positivo;4.7;230;2.199;1.499
Ventilador De Resfriamento De Substituição Compatível Para;;;;56.0;53.0
Compatível Com Latitude 3520 Lcd, Capa Traseira, 0kjrhf;;;;194.0;184.0
Tampa De Base De Reposição Compatível;;;;52.0;50.0
Conjunto De Interruptores De Teclado Mecânico Compatíveis,;;;;52.0;50.0
Cabo De Extensão Compatível Com Placa-mãe Pcie X1 Para X1;;;;51.0;49.0
Ventilador De Resfriamento De Substituição Compatível Para;;;;51.0;49.0
Notebook HP 256R G9 Intel Core i5-1334U 15.6 HD Intel UHD 256GB SSD 16GB RAM Windows 11 Home 64 PLS SL - BQ9L2AT#AK4;HP;5.0;2;4.754;3.324
"Notebook Vaio Fe16 Amd Ryzen 7-5825u Linux 16gb RAM 512gb Ssd Wi-Fi 6 Tela 16"" Ips Wuxga Antirreflexo Cinza Grafite Vjfe69f11xb0121h - Permite upgrade de memória RAM e SSD";Vaio;4.8;134;4.799;3.449
"Notebook Lenovo IdeaPad Slim 3 15IRH10 Intel Core i5-13420H 8GB 512GB SSD Windows 11 15.3"" - 83NS0002BR Luna Grey";NegociuN;5.0;2;4.089;3.329
Interruptor De Teclado De Campainha Compatível;;;;50.0;47.0
Conector Compatível 5.5x2.1mm 10 Peças 12v Dc Enchufe;;;;49.0;47.0
1 Conjunto De Interruptores De Teclado Mecânico Compatível;;;;49.0;46.0
Cabo Compatível Pwm 3/quatro Pinos Pwm Ventilador A 3;;;;49.0;46.0
Compatível Substitui Teclado, Substituição, Durável E;;;;49.0;46.0
Compatível Com Substituição Precisa De Recortes Precisos Do;;;;49.0;46.0
Notebook Positivo Vision R15 Lumina Bar, Amd Ryzen 7 16gb 512gb, Tela 15 Polegadas Full Hd Antirreflexo, Linux - Preto;Positivo;4.6;57;3.899;2.699
"Notebook Gamer Acer Nitro V15 I7-13620h 13ªGen 8gb 512gb Rtx3050 6gb Linux 15.6"" FHD Preto - Anv15-51-7837";2Eletro;4.4;42;6.998;4.899
Notebook Lenovo V14 Amd R5 7520u 8gb 256gb Ssd W11 Pro Preto;2Eletro;4.3;7;4.11;2.999
Porta De Carregamento Usb Compatível Com Pcb De Licença;;;;49.0;46.0
Plugue Quadrado De 35 Mm Compatível Com Soquete Quadrado;;;;49.0;46.0
Adesivos Compatíveis Para Teclado De Computador, Adesivos;;;;40.0;38.0
Notebook Gamer Acer Nitro V15 - 15.6 144hz Ips, Intel Core I7 13620h (13ª Geração) 4.90ghz, Nvidia Geforce Rtx 3050 6gb Gddr6, 8gb Ram Ddr5, 512gb Ssd Pcie 4.0 Nvme, Áudio Dts, Preto - Anv15-51-7837;Eshop;5.0;60;7.419;5.025
Capa Compatível 5cb1f38660 Para Legion 5 15iah7 15arh7 5;;;;113.0;107.0
Notebook Positivo Vision C15 Lumina Bar Celeron, 8gb 256gb Emmc, Tela 15 Polegadas Hd Antirreflexo, Linux, Tecla Link, Cinza;Positivo;4.7;230;2.199;1.499
Notebook Multi Ultra Celeron N4020c 4gb 128gb W11 15,6 Cinza;123 Comprou;4.9;8;2.141;1.321
Notebook Asus Vivobook 15 X1504va Intel Core I5 1334u 8gb Ram 256gb Ssd Linux Keepos Intel Iris Xe Tela 15,6 Led Fhd Silver - Nj1739;Mercado Livre;4.6;23;2.899;2.706
Notebook Gamer ASUS TUF Gaming A15, Ryzen 7, RTX 2050, 8GB RAM, 512GB SSD, Tela 15.6 IPS 144Hz, Linux KeepOS, Graphite Black - FA506NFR-HN069;;4.8;167;;4.199
Case Compatível Com Base Inferior Inferior Novo Para;;;;259.0;246.0
Notebook Positivo Vision C14 Lumina BAR Celeron 4GB 128GB eMMC Tela 14 Polegadas HD Antirreflexo Windows 11 Tecla Link Cinza;Positivo;4.6;4697;1.799;1.399
Capa Traseira Compatível Com Latitude 3330;;;;221.0;210.0
Notebook VAIO FE15 Intel Core i5 12ªgen 8GB 512GB SSD Tela 15,6'' Full HD Antirreflexo Linux - Cinza Grafite - VJFE54F11XB2321H;Eshop;4.8;82;4.95;2.948
Notebook Lenovo Ideapad 1 15amn7 Amd Ryzen 3 7320u 8gb 256gb Ssd Windows 11 15.6 - 82x5000mbr Cloud Grey;Lenovo;5.0;3;2.449;2.159
Capa Traseira Lcd Compatível 5cb1f09912, Nova Para Ideapad;;;;200.0;190.0
Notebook Asus Vivobook Go Core I3 N305 4gb 256ssd W11 Fhd;Mercado Livre;4.7;657;2.599;2.329
Módulo De Cpu Compatível Com Ventilador De Resfriamento;;;;185.0;176.0
Notebook VAIO FE16 AMD Ryzen 5-5625U Windows 11 Home 16GB RAM 512GB SSD Wi-Fi 6 Tela 16” IPS Full HD WUXGA Antirreflexo Cinza Grafite Vjfe69f11xb0721h - Permite upgrade de memória RAM e SSD;Positivo;5.0;4;4.887;3.849
Notebook Acer Aspire 15 Ag15-51p-39mu Ci3 8gb 256gb Ssd Led Ips W11;Mercado Livre;5.0;6;4.004;2.699
Compatível Cubierta Frontal Lcd 0f3whn For Pantalla;;;;162.0;154.0
Laptop Dell Inspiron i15-i1300-M50P 15.6 Full HD de 13ª geração RAM 16 GB Core i5 Cor Preto;;4.9;87;5.2;4.784
"Notebook Gamer Acer Nitro V15 I7-13620h 13ªGen 8gb 512gb Rtx3050 6gb Linux 15.6"" FHD Preto - Anv15-51-7837";2Eletro;4.4;42;6.998;4.899
Notebook Hp Probook 440 G7 I7 10a 16gb 256gb Nvidia Mx130 2g Prateado (Recondicionado);;;;;2.499
Notebook Lenovo T480 Core I5-8ªth 16gb Ssd 240gb Tela Hd Cor Black - Excelente (Recondicionado);;;;;1.839
"Notebook Lenovo Ideapad Intel Celeron - N4020, 4GB RAM, 128SSD, Windows 11 Home C/office, Tela Led 15,6"", Cor Cinza - 82VX0001BR";Eletro2U;4.7;1896;2.499;1.799
Notebook Dell Latitude 3420 I7 11a Ge 32gb Ram 256gb Nvme Preto (Recondicionado);;;;2.9;2.755
"Notebook ASUS Vivobook Go E1504FA AMD Ryzen 5 7520U 8GB Ram 256GB SSD Windows 11 Tela 15,6"" FHD Black - NJ825W";Mercado Livre;4.8;166;2.999;2.668
Notebook Positivo Vision C14 Lumina Bar Celeron 8gb 256gb Emmc Tela 14 Polegadas Hd Antirreflexo Linux Tecla Link - Cinza;Positivo;4.5;559;2.099;1.399
Notebook Lenovo Ideapad 1 15iru7 Intel Core i3-1315u 8gb 256gb Ssd Linux 15.6 - 83qjs00000 Cloud Grey;Lenovo;;;2.499;2.189
Compatível Novo For Legion 5 Pro-16ach6h Maiúsculas;;;;259.0;246.0
Notebook Gamer Rog Strix G16 Core I9 16gb 512ssd W11 Rtx 4060 Cor Cinza Asus;Mercado Livre;4.8;71;12.5;10.2
Apple Macbook air 13 M4 16gb Ram 256gb Ssd Meia-noite;;5.0;5;;7.295
Compatível Com 5cb1f36618 Para Ideapad 1-15ada7 1 15amn7 Lcd;;;;117.0;111.0
Notebook Lenovo Ideapad 1 Ryzen 5 - 7520u 8gb 512gb Ssd Linux 15.6 82X5S00500;Lenovo;4.8;1195;2.699;2.379
Notebook Asus Vivobook 15 X1504va Intel Core I5 1334u 16gb Ram 512gb Ssd Linux Keepos Intel Iris Xe Tela 15,6 Led Fhd Blue - Nj1746;Asus;4.9;54;3.699;2.831
Apple Macbook Pro A2141 Core I9 9 Gen 16gb 1tb Ssd Cinza Cinza (Recondicionado);;;;6.833;6.491
Notebook Dell 15.6  Fhd Intel I7 16gb 512gb Ssd Preto;Dell;4.8;47;4.739;4.399
Notebook Positivo Vision C14 Lumina Bar Celeron 8gb 256gb Emmc Tela 14 Polegadas Hd Antirreflexo Linux Tecla Link - Cinza;Positivo;4.5;559;2.099;1.399
Notebook Positivo Vision C15 Lumina Bar Celeron, 8gb 256gb Emmc, Tela 15 Polegadas Hd Antirreflexo, Linux, Tecla Link, Cinza;Positivo;4.7;230;2.199;1.499
Notebook Asus Vivobook 15 X1504va Intel Core I5 1334u 16gb Ram 512gb Ssd Linux Keepos Intel Iris Xe Tela 15,6 Led Fhd Blue - Nj1746;Asus;4.9;54;3.699;2.831
Apple Macbook Pro A2141 Core I9 9 Gen 16gb 1tb Ssd Cinza Cinza (Recondicionado);;;;6.833;6.491
Compatível Nova Cubierta Superior 0djp76 Para Latitude 3520;;;;211.0;200.0
Notebook Lenovo Core I7 10th 16gb Ram 256gb Ssd Windows 11 Preto (Recondicionado);;5.0;1;;2.39
"Notebook Vaio Fe16 Amd Ryzen 7-5825u Linux 16gb RAM 512gb Ssd Wi-Fi 6 Tela 16"" Ips Wuxga Antirreflexo Cinza Grafite Vjfe69f11xb0121h - Permite upgrade de memória RAM e SSD";Vaio;4.8;134;4.799;3.449
Notebook Dell Core I5 8th 16 Gb Ddr4 240 Gb Ssd M2 Full Hd;Tech Forte;;;2.599;2.105
Notebook HP 256R G9 Intel Core i5-1334U 15.6 HD Intel UHD 256GB SSD 16GB RAM Windows 11 Home 64 PLS SL - BQ9L2AT#AK4;HP;5.0;2;4.754;3.324
